{
  "binding_id": "skill_ingest_store_episode_binding_v1",
  "skill_id": "skill.skill_ingest_store_episode_basic",
  "runtime_type": "local_script",
  "entrypoint": {
    "command": "node",
    "path": "skills/skill_ingest_store_episode_basic/impl/code/store_episode.js",
    "notes": "Stores ds.episode_skill_ingest_run_v1 on the file system."
  },
  "verbs": [
    "store"
  ],
  "meta": {
    "note": "Default path: lab/episodes/skill_ingest. Override via STORE_EPISODE_BASE_DIR or options.baseDir."
  },
  "created_at": "2025-12-05T00:00:00Z",
  "updated_at": "2025-12-05T00:00:00Z"
}
