{
  "binding_id": "skill_scaffolder_llm_binding_v1",
  "skill_id": "skill.skill_scaffolder_basic",
  "runtime_type": "other",
  "entrypoint": {
    "profile_path": "impl/prompts/skill_scaffolder_profile.md",
    "notes": "LLM profile runtime: execute LLM with this profile, no external calls."
  },
  "verbs": [
    "transform"
  ],
  "meta": {
    "note": "LLM-only binding: the skill is executed by an LLM following the prompt profile. No external HTTP requests, MCP calls, or local scripts.",
    "environment": "llm"
  },
  "created_at": "2025-12-03T19:45:00Z",
  "updated_at": "2025-12-03T19:45:00Z"
}

