{
  "binding_id": "skill_mova_ai_bootstrap_generate_binding_v1",
  "skill_id": "skill.mova_ai_bootstrap_generate_basic",
  "runtime_type": "local_script",
  "entrypoint": {
    "command": "node",
    "path": "skills/skill_mova_ai_bootstrap_generate_basic/impl/code/generate_bootstrap.js",
    "notes": "Generates ds.mova_ai_bootstrap_pack_v1 from a static resource JSON with no external calls."
  },
  "verbs": [
    "transform"
  ],
  "meta": {
    "note": "Uses the static resource impl/resources/mova_ai_bootstrap_instructions_en.json; language support is currently English only."
  },
  "created_at": "2025-12-05T00:00:00Z",
  "updated_at": "2025-12-05T00:00:00Z"
}
