{
  "binding_id": "skill_file_cleanup_snapshot_binding_v1",
  "skill_id": "skill.file_cleanup_snapshot_node_basic",
  "runtime_type": "local_script",
  "entrypoint": {
    "command": "node",
    "path": "skills/skill_file_cleanup_snapshot_node_basic/impl/code/run_snapshot.js",
    "notes": "Scans filesystem and outputs ds.file_cleanup_snapshot_v1; no deletions."
  },
  "verbs": [
    "scan"
  ],
  "meta": {
    "note": "Reads env.file_cleanup_snapshot_request_v1 and produces ds.file_cleanup_snapshot_v1."
  },
  "created_at": "2025-12-05T00:00:00Z",
  "updated_at": "2025-12-05T00:00:00Z"
}
