{
  "binding_id": "wf_cycle_compute_compare_local_node_binding_v1",
  "skill_id": "skill.wf_cycle_compute_compare_basic",
  "runtime_type": "local_script",
  "entrypoint": {
    "command": "node",
    "path": "skills/wf_cycle_compute_compare_basic/impl/bindings/node/compute_compare.mjs",
    "notes": "Local deterministic compare: reads ds.wf_cycle_compare_request_v1 JSON and writes compare folder artifacts + prints ds.wf_cycle_compare_result_v1."
  },
  "verbs": [
    "transform"
  ],
  "meta": {
    "environment": "local",
    "implementation_status": "implemented",
    "notes": "Must not write to lab/memory/**. Intended to be used in experiments to build canonical compare folders."
  },
  "created_at": "2025-12-14T00:00:00Z",
  "updated_at": "2025-12-14T00:00:00Z"
}

