{
  "binding_id": "station_cycle_local_node_binding_v1",
  "skill_id": "skill.station_cycle_v1",
  "runtime_type": "local_script",
  "entrypoint": {
    "command": "node",
    "path": "skills/station_cycle_v1/impl/bindings/run_station_cycle.js",
    "notes": "Runs the station cycle orchestrator script in this repo."
  },
  "verbs": [
    "transform"
  ],
  "meta": {
    "environment": "local",
    "notes": "Coordinates repo snapshot, gate checks, and optional WF cycle steps."
  },
  "created_at": "2025-12-29T00:00:00Z",
  "updated_at": "2025-12-29T00:00:00Z"
}
